{
  "schema_version": "4.0.0",
  "generated": "2026-06-20",
  "description": "Static database of providers and routes the OpenReceive payment wizard can suggest for paying a BOLT11 Lightning invoice.",
  "filter": "Providers that can send to an arbitrary third-party BOLT11 Lightning invoice, including withdrawal and swap payout flows.",
  "_meta": {
    "provider_fields": {
      "id": "stable slug key",
      "name": "display name",
      "kind": "short provider category shown as a one-line UI subtitle",
      "url": "homepage",
      "us": "true=US-available, false=US-excluded, null=unknown",
      "lightning_docs_url": "official how-to-pay/send Lightning invoice page, or null",
      "icon_path": "repo-local icon path used by browser UI",
      "tutorials": "optional ordered app-specific payment tutorial screenshots"
    },
    "route_ref_fields": {
      "provider": "provider id",
      "rank": "1-based route-specific display ordering; required when a route has explicit ranked suggestions"
    }
  },
  "assets_index": [
    {
      "symbol": "btc",
      "label": "Bitcoin Lightning",
      "route": "btc-lightning"
    },
    {
      "symbol": "usdt",
      "label": "Tether (USDT — any chain)",
      "route": "usdt"
    },
    {
      "symbol": "usdc",
      "label": "USD Coin (USDC)",
      "route": "usdc"
    },
    {
      "symbol": "eth",
      "label": "Ethereum (ETH)",
      "route": "eth"
    },
    {
      "symbol": "xmr",
      "label": "Monero (XMR)",
      "route": "xmr"
    },
    {
      "symbol": "ltc",
      "label": "Litecoin (LTC)",
      "route": "ltc"
    },
    {
      "symbol": "trx",
      "label": "Tron (TRX)",
      "route": "trx"
    },
    {
      "symbol": "sol",
      "label": "Solana (SOL)",
      "route": "sol"
    },
    {
      "symbol": "xrp",
      "label": "XRP",
      "route": "xrp"
    },
    {
      "symbol": "usd",
      "label": "US Dollars (bank / card)"
    },
    {
      "symbol": "eur",
      "label": "Euro (SEPA / bank)"
    },
    {
      "symbol": "gbp",
      "label": "British Pound"
    }
  ],
  "providers": {
    "rizful": {
      "id": "rizful",
      "name": "Rizful.com",
      "kind": "browser wallet",
      "url": "https://rizful.com",
      "us": null,
      "lightning_docs_url": "https://rizful.com/pay_lightning_invoice/rizful",
      "icon_path": "assets/provider-icons/rizful.webp"
    },
    "boltz": {
      "id": "boltz",
      "name": "Boltz",
      "kind": "swap service",
      "url": "https://boltz.exchange",
      "us": null,
      "lightning_docs_url": "https://api.docs.boltz.exchange/lifecycle.html",
      "icon_path": "assets/provider-icons/boltz.webp",
      "tutorials": [
        {
          "index": 1,
          "path": "assets/pay_tutorials/boltz-1.webp",
          "caption": "Select the currency you want to start with, and select Receive LN (Bitcoin Lightning)"
        },
        {
          "index": 2,
          "path": "assets/pay_tutorials/boltz-2.webp",
          "caption": "Paste Lightning invoice and click Create Swap"
        }
      ]
    },
    "strike": {
      "id": "strike",
      "name": "Strike",
      "kind": "payments app",
      "url": "https://strike.me",
      "us": true,
      "lightning_docs_url": "https://docs.strike.me/walkthrough/sending-payments/",
      "icon_path": "assets/provider-icons/strike.webp",
      "tutorials": [
        {
          "index": 1,
          "path": "assets/pay_tutorials/strike-1.webp",
          "caption": "Tap Send"
        },
        {
          "index": 2,
          "path": "assets/pay_tutorials/strike-2.webp",
          "caption": "Choose Bitcoin wallet"
        },
        {
          "index": 3,
          "path": "assets/pay_tutorials/strike-3.webp",
          "caption": "Tap Paste"
        },
        {
          "index": 4,
          "path": "assets/pay_tutorials/strike-4.webp",
          "caption": "Confirm the payment"
        }
      ]
    },
    "aqua": {
      "id": "aqua",
      "name": "Aqua Wallet",
      "kind": "mobile wallet",
      "url": "https://aqua.net",
      "us": null,
      "lightning_docs_url": "https://aqua.net/",
      "icon_path": "assets/provider-icons/aqua.webp"
    },
    "phoenix": {
      "id": "phoenix",
      "name": "Phoenix",
      "kind": "mobile wallet",
      "url": "https://phoenix.acinq.co",
      "us": null,
      "lightning_docs_url": null,
      "icon_path": "assets/provider-icons/phoenix.webp"
    },
    "zeus": {
      "id": "zeus",
      "name": "Zeus",
      "kind": "mobile wallet",
      "url": "https://zeusln.com",
      "us": true,
      "lightning_docs_url": "https://docs.zeusln.app/",
      "icon_path": "assets/provider-icons/zeus.webp"
    },
    "coinbase": {
      "id": "coinbase",
      "name": "Coinbase",
      "kind": "exchange",
      "url": "https://coinbase.com",
      "us": true,
      "lightning_docs_url": "https://help.coinbase.com/en/coinbase/trading-and-funding/sending-or-receiving-cryptocurrency/lightning",
      "icon_path": "assets/provider-icons/coinbase.webp",
      "tutorials": [
        {
          "index": 1,
          "path": "assets/pay_tutorials/coinbase-1.webp",
          "caption": "Tap Pay"
        },
        {
          "index": 2,
          "path": "assets/pay_tutorials/coinbase-2.webp",
          "caption": "Tap the QR scanner"
        }
      ]
    },
    "kraken": {
      "id": "kraken",
      "name": "Kraken",
      "kind": "exchange",
      "url": "https://kraken.com",
      "us": true,
      "lightning_docs_url": "https://support.kraken.com/articles/5068216131988-how-do-i-send-bitcoin-on-the-lightning-network-",
      "icon_path": "assets/provider-icons/kraken.webp",
      "tutorials": [
        {
          "index": 1,
          "path": "assets/pay_tutorials/kraken-1.webp",
          "caption": "Tap Bitcoin"
        },
        {
          "index": 2,
          "path": "assets/pay_tutorials/kraken-2.webp",
          "caption": "Tap Withdraw"
        },
        {
          "index": 3,
          "path": "assets/pay_tutorials/kraken-3.webp",
          "caption": "Choose Lightning"
        },
        {
          "index": 4,
          "path": "assets/pay_tutorials/kraken-4.webp",
          "caption": "Paste or scan the invoice"
        }
      ]
    },
    "binance": {
      "id": "binance",
      "name": "Binance",
      "kind": "exchange",
      "url": "https://binance.com",
      "us": false,
      "lightning_docs_url": "https://www.binance.com/en/support/faq/how-to-use-the-bitcoin-lightning-network-to-deposit-and-withdraw-btc-on-binance-7a4eb2d9ccaf4433908b448aa3a93493",
      "icon_path": "assets/provider-icons/binance.webp"
    },
    "okx": {
      "id": "okx",
      "name": "OKX",
      "kind": "exchange",
      "url": "https://okx.com",
      "us": false,
      "lightning_docs_url": "https://www.okx.com/en-us/help/how-do-i-withdraw-bitcoin-btc-with-okx-lightning-network",
      "icon_path": "assets/provider-icons/okx.webp"
    },
    "bitfinex": {
      "id": "bitfinex",
      "name": "Bitfinex",
      "kind": "exchange",
      "url": "https://bitfinex.com",
      "us": false,
      "lightning_docs_url": "https://support.bitfinex.com/hc/en-us/articles/360039801053-Lightning-Network-BTC-LN-BTC-Deposits-Withdrawals",
      "icon_path": "assets/provider-icons/bitfinex.webp"
    },
    "kucoin": {
      "id": "kucoin",
      "name": "KuCoin",
      "kind": "exchange",
      "url": "https://kucoin.com",
      "us": false,
      "lightning_docs_url": null,
      "icon_path": "assets/provider-icons/kucoin.webp"
    },
    "cashapp": {
      "id": "cashapp",
      "name": "Cash App",
      "kind": "payments app",
      "url": "https://cash.app",
      "us": true,
      "lightning_docs_url": "https://cash.app/help/us/en-US/6506-lightning",
      "icon_path": "assets/provider-icons/cashapp.webp",
      "tutorials": [
        {
          "index": 1,
          "path": "assets/pay_tutorials/cashapp-1.webp",
          "caption": "Tap your Bitcoin balance"
        },
        {
          "index": 2,
          "path": "assets/pay_tutorials/cashapp-2.webp",
          "caption": "Tap the transfer button"
        },
        {
          "index": 3,
          "path": "assets/pay_tutorials/cashapp-3.webp",
          "caption": "Choose Send"
        },
        {
          "index": 4,
          "path": "assets/pay_tutorials/cashapp-4.webp",
          "caption": "Tap the QR scanner"
        },
        {
          "index": 5,
          "path": "assets/pay_tutorials/cashapp-5.webp",
          "caption": "Paste the invoice"
        },
        {
          "index": 6,
          "path": "assets/pay_tutorials/cashapp-6.webp",
          "caption": "Confirm and pay"
        }
      ]
    },
    "river": {
      "id": "river",
      "name": "River Financial",
      "kind": "brokerage",
      "url": "https://river.com",
      "us": true,
      "lightning_docs_url": "https://support.river.com/hc/en-us/articles/45489800672915-How-do-I-send-bitcoin",
      "icon_path": "assets/provider-icons/river.webp"
    },
    "coincorner": {
      "id": "coincorner",
      "name": "CoinCorner",
      "kind": "exchange",
      "url": "https://coincorner.com",
      "us": false,
      "lightning_docs_url": "https://support.coincorner.com/hc/en-us/articles/360020667299-Sending-and-receiving-via-Lightning",
      "icon_path": "assets/provider-icons/coincorner.webp"
    },
    "bullbitcoin": {
      "id": "bullbitcoin",
      "name": "Bull Bitcoin",
      "kind": "brokerage",
      "url": "https://bullbitcoin.com",
      "us": false,
      "lightning_docs_url": "https://www.bullbitcoin.com/",
      "icon_path": "assets/provider-icons/bullbitcoin.webp"
    },
    "fixedfloat": {
      "id": "fixedfloat",
      "name": "FixedFloat",
      "kind": "swap service",
      "url": "https://fixedfloat.com",
      "us": false,
      "lightning_docs_url": "https://ff.io/",
      "icon_path": "assets/provider-icons/fixedfloat.webp",
      "tutorials": [